full_text,image_url,network,body,display,platform,performance,memory,camera,sound,communications,features,battery,accessories,ocr_text,combined_text,processed_combined_text,pred_network,pred_body,pred_display,pred_platform,pred_performance,pred_memory,pred_camera,pred_sound,pred_communications,pred_features,pred_battery,pred_accessories
"Kualitas aksesoris iPhone 16 third-party yang beredar di pasaran sangat bervariasi, sulit memilih.",0,0,0,0,0,0,0,0,0,0,0,0,1,,"Kualitas aksesoris iPhone 16 third-party yang beredar di pasaran sangat bervariasi, sulit memilih. ",kualitas aksesoris thirdparty edar pasar variasi sulit pilih,0,0,0,0,0,0,0,0,0,0,0,1
"Desain bodi iPhone 16 ini innovative, selalu ada hal baru yang ditawarkan.",0,0,2,0,0,0,0,0,0,0,0,0,0,,"Desain bodi iPhone 16 ini innovative, selalu ada hal baru yang ditawarkan. ",desain bodi innovative tawar,0,2,0,0,0,0,0,0,0,0,0,0
"Pengisian cepat iPhone 16 lebih cepat dari kompetitor, kecepatan pengisian cepat iPhone 16  lebih unggul dibanding HP flagship kompetitor lain,  Apple terdepan soal fast charging.",0,0,0,0,0,0,0,0,0,0,0,2,0,,"Pengisian cepat iPhone 16 lebih cepat dari kompetitor, kecepatan pengisian cepat iPhone 16  lebih unggul dibanding HP flagship kompetitor lain,  Apple terdepan soal fast charging. ",isi cepat cepat kompetitor cepat isi cepat unggul banding hp flagship kompetitor depan fast charging,0,0,0,0,0,0,0,0,0,0,2,0
"Vibrancy algorithm output iPhone 16 lambat diganti, vibrancy algorithm sulit diganti options selection dan kurang efektif untuk menyesuaikan opsi algorithm vibrancy pada output foto dan video, tidak simpel.",0,0,0,0,0,0,0,1,0,0,0,0,0,,"Vibrancy algorithm output iPhone 16 lambat diganti, vibrancy algorithm sulit diganti options selection dan kurang efektif untuk menyesuaikan opsi algorithm vibrancy pada output foto dan video, tidak simpel. ",vibrancy algorithm output lambat ganti vibrancy algorithm sulit ganti options selection efektif sesuai opsi algorithm vibrancy output foto video simpel,0,0,0,0,0,0,1,0,0,0,0,0
"Dark mode IOS 18 iPhone 16 ini kurang maksimal, gak terlalu gelap, kurang kontras, gak terlalu hemat baterai, *dark mode nya nanggung dan *kurang deep.",0,0,0,0,1,0,0,0,0,0,0,0,0,,"Dark mode IOS 18 iPhone 16 ini kurang maksimal, gak terlalu gelap, kurang kontras, gak terlalu hemat baterai, *dark mode nya nanggung dan *kurang deep. ",dark mode ios maksimal gelap kontras hemat baterai dark mode nya nanggung deep,0,0,0,1,0,0,0,0,0,0,0,0
@LeakerApple 16 Pro Max &gt;&gt;&gt;&gt; S24 Ultra &gt;&gt;&gt;&gt; 9 Pro XL Basis S24 &gt;&gt;&gt;&gt; Piksel 9 &gt;&gt;&gt;&gt; iPhone 16 jelek dalam bermain game,0,0,0,0,0,1,0,0,0,0,0,0,0,,@LeakerApple 16 Pro Max &gt;&gt;&gt;&gt; S24 Ultra &gt;&gt;&gt;&gt; 9 Pro XL Basis S24 &gt;&gt;&gt;&gt; Piksel 9 &gt;&gt;&gt;&gt; iPhone 16 jelek dalam bermain game ,leakerapple gtgtgtgt ultra gtgtgtgt xl basis gtgtgtgt piksel gtgtgtgt jelek main game,0,0,0,0,1,0,0,0,0,0,0,0
"Apple Intelligence iPhone 16 user-friendly,  fitur AI mudah digunakan dan dipahami bahkan untuk pengguna awam sekalipun.",0,0,0,0,0,0,0,0,0,0,2,0,0,,"Apple Intelligence iPhone 16 user-friendly,  fitur AI mudah digunakan dan dipahami bahkan untuk pengguna awam sekalipun. ",intelligence userfriendly fitur mudah paham guna awam,0,0,0,0,0,0,0,0,0,2,0,0
"iPhone 16 ini desain bodinya amazing, benar-benar game changer di dunia desain HP.",0,0,2,0,0,0,0,0,0,0,0,0,0,,"iPhone 16 ini desain bodinya amazing, benar-benar game changer di dunia desain HP. ",desain bodi amazing benarbenar game changer dunia desain hp,0,2,0,0,0,0,0,0,0,0,0,0
"Performa memory iPhone 16 stabil dan reliable, tidak pernah crash atau error terkait memory.""",0,0,0,0,0,0,2,0,0,0,0,0,0,,"Performa memory iPhone 16 stabil dan reliable, tidak pernah crash atau error terkait memory."" ",performa memory stabil reliable crash error kait memory,0,0,0,0,0,2,0,0,0,0,0,0
"Output kamera iPhone 16 aman privasinya, tidak ada isu kebocoran data atau penyalahgunaan akses kamera, terpercaya.",0,0,0,0,0,0,0,2,0,0,0,0,0,,"Output kamera iPhone 16 aman privasinya, tidak ada isu kebocoran data atau penyalahgunaan akses kamera, terpercaya. ",output kamera aman privasi isu bocor data penyalahgunaan akses kamera percaya,0,0,0,0,0,0,2,0,0,0,0,0
"Grafik penggunaan baterai iPhone 16 visualisasi data baik, grafik penggunaan baterai mudah dipahami visualisasinya,  data penggunaan baterai disajikan secara menarik dan informatif.",0,0,0,0,0,0,0,0,0,0,0,2,0,,"Grafik penggunaan baterai iPhone 16 visualisasi data baik, grafik penggunaan baterai mudah dipahami visualisasinya,  data penggunaan baterai disajikan secara menarik dan informatif. ",grafik guna baterai visualisasi data grafik guna baterai mudah paham visualisasi data guna baterai saji tarik informatif,0,0,0,0,0,0,0,0,0,0,2,0
"Teknologi pengisian daya terbaru di iPhone 16  keren,  Apple selalu update teknologi pengisian daya,  pengisian daya iPhone makin canggih.",0,0,0,0,0,0,0,0,0,0,0,2,0,,"Teknologi pengisian daya terbaru di iPhone 16  keren,  Apple selalu update teknologi pengisian daya,  pengisian daya iPhone makin canggih. ",teknologi isi daya baru keren update teknologi isi daya isi daya canggih,0,0,0,0,0,0,0,0,0,0,2,0
"Layar iPhone 16 resilient, ketahanan layar terhadap goresan dan benturan ditingkatkan, siap menghadapi tantangan.",0,0,0,2,0,0,0,0,0,0,0,0,0,,"Layar iPhone 16 resilient, ketahanan layar terhadap goresan dan benturan ditingkatkan, siap menghadapi tantangan. ",layar resilient tahan layar gores bentur tingkat hadap tantang,0,0,2,0,0,0,0,0,0,0,0,0
@mngwema_tz @theapplehub @blogdoiphone Apple mencoba membuat kami percaya bahwa iPhone 16+ dengan baterai yang sama dan layar 60hz kurang bertenaga dibandingkan 16 Pro Max. Harus menemukan beberapa argumen untuk menjualnya entah bagaimana...,0,0,0,1,0,0,0,0,0,0,0,1,0,,@mngwema_tz @theapplehub @blogdoiphone Apple mencoba membuat kami percaya bahwa iPhone 16+ dengan baterai yang sama dan layar 60hz kurang bertenaga dibandingkan 16 Pro Max. Harus menemukan beberapa argumen untuk menjualnya entah bagaimana... ,mngwematz theapplehub blogdoiphone coba percaya baterai layar tenaga banding temu argumen jual,0,0,1,0,0,0,0,0,0,0,1,0
"Audio levels display scale output iPhone 16 gampang diganti, audio levels display scale mudah diganti option selection untuk menyesuaikan opsi display scale audio levels pada output video, simpel.",0,0,0,0,0,0,0,2,0,0,0,0,0,,"Audio levels display scale output iPhone 16 gampang diganti, audio levels display scale mudah diganti option selection untuk menyesuaikan opsi display scale audio levels pada output video, simpel. ",audio levels display scale output gampang ganti audio levels display scale mudah ganti option selection sesuai opsi display scale audio levels output video simpel,0,0,0,0,0,0,2,0,0,0,0,0
"Zebra stripes threshold output iPhone 16 cepat diatur, zebra stripes threshold mudah diatur ambangnya untuk menyesuaikan batas overexposure pada output foto dan video, instan.",0,0,0,0,0,0,0,2,0,0,0,0,0,,"Zebra stripes threshold output iPhone 16 cepat diatur, zebra stripes threshold mudah diatur ambangnya untuk menyesuaikan batas overexposure pada output foto dan video, instan. ",zebra stripes threshold output cepat atur zebra stripes threshold mudah atur ambang sesuai batas overexposure output foto video instan,0,0,0,0,0,0,2,0,0,0,0,0
Timbre suara pembicara secara akurat mereproduksi nada instrumen yang dibunyikan sesuai dengan suara aslinya yang alami.,0,0,0,0,0,0,0,0,2,0,0,0,0,,Timbre suara pembicara secara akurat mereproduksi nada instrumen yang dibunyikan sesuai dengan suara aslinya yang alami. ,timbre suara bicara akurat reproduksi nada instrumen bunyi sesuai suara asli alami,0,0,0,0,0,0,0,2,0,0,0,0
"Material bodi iPhone 16 makin solid, gak khawatir lagi lecet atau rusak. Investasi yang bagus nih.",0,0,2,0,0,0,0,0,0,0,0,0,0,,"Material bodi iPhone 16 makin solid, gak khawatir lagi lecet atau rusak. Investasi yang bagus nih. ",material bodi solid khawatir lecet rusak investasi bagus nih,0,2,0,0,0,0,0,0,0,0,0,0
"FPS game di iPhone 16 stabil di 60 FPS terus! Grafis detail, smooth gameplay, no drop frame, perfect buat ngegame kompetitif, GGWP!",0,0,0,0,0,2,0,0,0,0,0,0,0,,"FPS game di iPhone 16 stabil di 60 FPS terus! Grafis detail, smooth gameplay, no drop frame, perfect buat ngegame kompetitif, GGWP! ",fps game stabil fps grafis detail smooth gameplay no drop frame perfect ngegame kompetitif ggwp,0,0,0,0,2,0,0,0,0,0,0,0
"Buat editing video gameplay kualitas tertinggi, iPhone 16 ini cepat banget prosesnya kayak jet tempur, performanya ngebut rendering video gameplay kualitas tertinggi secepat kilatan cahaya.",0,0,0,0,0,2,0,0,0,0,0,0,0,,"Buat editing video gameplay kualitas tertinggi, iPhone 16 ini cepat banget prosesnya kayak jet tempur, performanya ngebut rendering video gameplay kualitas tertinggi secepat kilatan cahaya. ",editing video gameplay kualitas tinggi cepat banget proses kayak jet tempur performa ngebut rendering video gameplay kualitas tinggi cepat kilat cahaya,0,0,0,0,2,0,0,0,0,0,0,0
Putuskan sambungan jaringan seluler dasar,0,1,0,0,0,0,0,0,0,0,0,0,0,,Putuskan sambungan jaringan seluler dasar ,putus sambung jaring seluler dasar,1,0,0,0,0,0,0,0,0,0,0,0
"Bodi iPhone 16 plastik banget, padahal harganya udah selangit. Materialnya mengecewakan.",0,0,1,0,0,0,0,0,0,0,0,0,0,,"Bodi iPhone 16 plastik banget, padahal harganya udah selangit. Materialnya mengecewakan. ",bodi plastik banget harga langit material kecewa,0,1,0,0,0,0,0,0,0,0,0,0
"Action Button iPhone 16 memudahkan personalisasi iPhone,  Action Button memberikan opsi personalisasi iPhone yang lebih luas sesuai preferensi pengguna.",0,0,0,0,0,0,0,0,0,0,2,0,0,,"Action Button iPhone 16 memudahkan personalisasi iPhone,  Action Button memberikan opsi personalisasi iPhone yang lebih luas sesuai preferensi pengguna. ",action button mudah personal action button opsi personal luas sesuai preferensi guna,0,0,0,0,0,0,0,0,0,2,0,0
"Adaptor casan iPhone 16 yang dijual terpisah kualitasnya bagus,  nge-charge stabil dan aman buat baterai,  worth it lah beli original.",0,0,0,0,0,0,0,0,0,0,0,2,0,,"Adaptor casan iPhone 16 yang dijual terpisah kualitasnya bagus,  nge-charge stabil dan aman buat baterai,  worth it lah beli original. ",adaptor cas jual pisah kualitas bagus ngecharge stabil aman baterai worth beli original,0,0,0,0,0,0,0,0,0,0,2,0
Aneh sekali bagaimana iPhone saya baik-baik saja hingga pengumuman iPhone 16,0,0,0,0,0,0,0,0,0,2,0,0,0,,Aneh sekali bagaimana iPhone saya baik-baik saja hingga pengumuman iPhone 16 ,aneh baikbaik umum,0,0,0,0,0,0,0,0,2,0,0,0
"RAM 8GB iPhone 16 terasa pas-pasan buat game berat terbaru, butuh RAM lebih besar untuk pengalaman gaming maksimal.",0,0,0,0,0,0,1,0,0,0,0,0,0,,"RAM 8GB iPhone 16 terasa pas-pasan buat game berat terbaru, butuh RAM lebih besar untuk pengalaman gaming maksimal. ",ram paspasan game berat baru butuh ram alam gaming maksimal,0,0,0,0,0,1,0,0,0,0,0,0
"Action Button iPhone 16  kontrol live caption kurang relevan buat semua orang,  fitur live caption jarang kepakai buat pengguna umum.",0,0,0,0,0,0,0,0,0,0,1,0,0,,"Action Button iPhone 16  kontrol live caption kurang relevan buat semua orang,  fitur live caption jarang kepakai buat pengguna umum. ",action button kontrol live caption relevan orang fitur live caption jarang pakai guna,0,0,0,0,0,0,0,0,0,1,0,0
"@AP Peluncuran perangkat lunak yang disempurnakan dengan AI untuk Siri di iPhone 16 oleh Apple menandai lompatan maju yang signifikan dalam teknologi asisten suara. Dengan pemahaman kontekstual yang lebih cerdas, waktu respons yang lebih cepat dan interaksi yang lebih intuitif, Siri berevolusi menjadi asisten sejati yang didukung AI. Ini",0,0,0,0,2,0,0,0,0,0,2,0,0,,"@AP Peluncuran perangkat lunak yang disempurnakan dengan AI untuk Siri di iPhone 16 oleh Apple menandai lompatan maju yang signifikan dalam teknologi asisten suara. Dengan pemahaman kontekstual yang lebih cerdas, waktu respons yang lebih cepat dan interaksi yang lebih intuitif, Siri berevolusi menjadi asisten sejati yang didukung AI. Ini ",luncur perangkat lunak sempurna siri tanda lompat maju signifikan teknologi asisten suara paham kontekstual cerdas respons cepat interaksi intuitif siri evolusi asisten sejati dukung,0,0,0,2,0,0,0,0,0,2,0,0
Apple akan mengenakan biaya lebih banyak untuk menukar baterai iPhone 16 Pro Anda https://t.co/tVApDF4XT3 melalui @Verge,0,0,0,0,0,0,0,0,0,0,0,1,0,,Apple akan mengenakan biaya lebih banyak untuk menukar baterai iPhone 16 Pro Anda https://t.co/tVApDF4XT3 melalui @Verge ,kena biaya tukar baterai verge,0,0,0,0,0,0,0,0,0,0,1,0
"Control Center IOS 18 iPhone 16 terlalu simpel, *kurang customization, gak bisa diubah-ubah sesuai selera.",0,0,0,0,1,0,0,0,0,0,0,0,0,,"Control Center IOS 18 iPhone 16 terlalu simpel, *kurang customization, gak bisa diubah-ubah sesuai selera. ",control center ios simpel customization diubahubah sesuai selera,0,0,0,1,0,0,0,0,0,0,0,0
"Bodi iPhone 16 ini too heavy to handle, berat banget dan bikin tangan pegel kalo dipake lama. Gak nyaman.",0,0,1,0,0,0,0,0,0,0,0,0,0,,"Bodi iPhone 16 ini too heavy to handle, berat banget dan bikin tangan pegel kalo dipake lama. Gak nyaman. ",bodi too heavy handle berat banget bikin tangan gel kalo pakai nyaman,0,1,0,0,0,0,0,0,0,0,0,0
"Animasi IOS 18 iPhone 16 ini terlalu smooth, malah jadi lebay dan gak natural, *kurang crisp dan sharp.",0,0,0,0,1,0,0,0,0,0,0,0,0,,"Animasi IOS 18 iPhone 16 ini terlalu smooth, malah jadi lebay dan gak natural, *kurang crisp dan sharp. ",animasi ios smooth lebay natural crisp sharp,0,0,0,1,0,0,0,0,0,0,0,0
"Warna suara speaker iPhone 16 akurat! Representasi tonalitas instrumen dan vokal sesuai aslinya, natural.",0,0,0,0,0,0,0,0,2,0,0,0,0,,"Warna suara speaker iPhone 16 akurat! Representasi tonalitas instrumen dan vokal sesuai aslinya, natural. ",warna suara speaker akurat representasi tonalitas instrumen vokal sesuai asli natural,0,0,0,0,0,0,0,2,0,0,0,0
"Buat editing video 8K, memory iPhone 16 ini powerful banget, performanya ngebut dan rendering nya cepat memory.""",0,0,0,0,0,0,2,0,0,0,0,0,0,,"Buat editing video 8K, memory iPhone 16 ini powerful banget, performanya ngebut dan rendering nya cepat memory."" ",editing video memory powerful banget performa ngebut rendering nya cepat memory,0,0,0,0,0,2,0,0,0,0,0,0
"Kecepatan internet memory iPhone 16 ini super cepat buat download dan upload file ke cloud storage, proses sinkronisasi data cepat dan efisien.""",0,0,0,0,0,0,2,0,0,0,0,0,0,,"Kecepatan internet memory iPhone 16 ini super cepat buat download dan upload file ke cloud storage, proses sinkronisasi data cepat dan efisien."" ",cepat internet memory super cepat download upload file cloud storage proses sinkronisasi data cepat efisien,0,0,0,0,0,2,0,0,0,0,0,0
"iPhone 16 ini cepat habis daya memory, performanya drop drastis memory kalo batre tinggal sedikit, efisiensi daya memory minimal.""",0,0,0,0,0,0,1,0,0,0,0,0,0,,"iPhone 16 ini cepat habis daya memory, performanya drop drastis memory kalo batre tinggal sedikit, efisiensi daya memory minimal."" ",cepat habis daya memory performa drop drastis memory kalo batre tinggal efisiensi daya memory minimal,0,0,0,0,0,1,0,0,0,0,0,0
"Review pengguna aksesoris iPhone 16 di internet masih kurang banyak, sulit mencari referensi.",0,0,0,0,0,0,0,0,0,0,0,0,1,,"Review pengguna aksesoris iPhone 16 di internet masih kurang banyak, sulit mencari referensi. ",review guna aksesoris internet sulit cari referensi,0,0,0,0,0,0,0,0,0,0,0,1
Lampu indikator charger fast charging iPhone 16 memudahkan mengetahui status pengisian daya.,0,0,0,0,0,0,0,0,0,0,0,0,2,,Lampu indikator charger fast charging iPhone 16 memudahkan mengetahui status pengisian daya. ,lampu indikator charger fast charging mudah status isi daya,0,0,0,0,0,0,0,0,0,0,0,2
"Widget IOS 18 iPhone 16 gak norak, minimalis, tapi tetep fungsional, gak kayak widget HP lain yang rame gak jelas.",0,0,0,0,2,0,0,0,0,0,0,0,0,,"Widget IOS 18 iPhone 16 gak norak, minimalis, tapi tetep fungsional, gak kayak widget HP lain yang rame gak jelas. ",widget ios norak minimal fungsional kayak widget hp rame,0,0,0,2,0,0,0,0,0,0,0,0
Upload foto ke Instagram langsung beres nggak pake loading,0,2,0,0,0,0,0,0,0,0,0,0,0,,Upload foto ke Instagram langsung beres nggak pake loading ,upload foto instagram langsung beres pakai loading,2,0,0,0,0,0,0,0,0,0,0,0
"Kompatibilitas aksesoris iPhone 16 terbatas hanya untuk produk Apple, tidak bisa digunakan di Android.",0,0,0,0,0,0,0,0,0,0,0,0,1,,"Kompatibilitas aksesoris iPhone 16 terbatas hanya untuk produk Apple, tidak bisa digunakan di Android. ",kompatibilitas aksesoris batas android,0,0,0,0,0,0,0,0,0,0,0,1
"Saya tidak sabar menunggu rilis iPhone 16, kameranya lebih baik, dan tombol baru. Saya akan menukar iPhone 15 yang saya dapatkan 8 bulan lalu dan tetap memiliki tagihan yang tidak pernah berakhir dengan T-Mobile. Meskipun saya hanya menggunakan media sosial dan mengirim pesan ke setiap iPhone selama 10 tahun terakhir",0,0,0,0,0,0,0,2,0,0,2,0,0,,"Saya tidak sabar menunggu rilis iPhone 16, kameranya lebih baik, dan tombol baru. Saya akan menukar iPhone 15 yang saya dapatkan 8 bulan lalu dan tetap memiliki tagihan yang tidak pernah berakhir dengan T-Mobile. Meskipun saya hanya menggunakan media sosial dan mengirim pesan ke setiap iPhone selama 10 tahun terakhir ",sabar tunggu rilis kamera tombol tukar dapat milik tagih tmobile media sosial kirim pesan,0,0,0,0,0,0,2,0,0,2,0,0
Baru sadar 5G itu game changer pas nyobain iPhone 16,0,2,0,0,0,0,0,0,0,0,0,0,0,,Baru sadar 5G itu game changer pas nyobain iPhone 16 ,sadar game changer pas coba,0,0,0,0,0,0,0,0,0,0,0,0
"Apple Intelligence iPhone 16 tertinggal dari kompetitor,  fitur AI Apple masih kalah canggih dibanding fitur AI di HP Android flagship lain.",0,0,0,0,0,0,0,0,0,0,1,0,0,,"Apple Intelligence iPhone 16 tertinggal dari kompetitor,  fitur AI Apple masih kalah canggih dibanding fitur AI di HP Android flagship lain. ",intelligence tinggal kompetitor fitur kalah canggih banding fitur hp android flagship,0,0,0,0,0,0,0,0,0,1,0,0
Semua casing iPhone 16 jelek dan mahal.,0,0,0,0,0,0,0,0,0,0,0,0,1,,Semua casing iPhone 16 jelek dan mahal. ,casing jelek mahal,0,0,0,0,0,0,0,0,0,0,0,1
"Brightness algorithm output iPhone 16 gampang diganti, brightness algorithm mudah diganti options selection untuk menyesuaikan opsi algorithm brightness pada output foto dan video, simpel.",0,0,0,0,0,0,0,2,0,0,0,0,0,,"Brightness algorithm output iPhone 16 gampang diganti, brightness algorithm mudah diganti options selection untuk menyesuaikan opsi algorithm brightness pada output foto dan video, simpel. ",brightness algorithm output gampang ganti brightness algorithm mudah ganti options selection sesuai opsi algorithm brightness output foto video simpel,0,0,0,0,0,0,2,0,0,0,0,0
RAM iPhone 16 masih sering memuat ulang aplikasi yang sudah lama tidak digunakan di background.,0,0,0,0,0,0,1,0,0,0,0,0,0,,RAM iPhone 16 masih sering memuat ulang aplikasi yang sudah lama tidak digunakan di background. ,ram muat ulang aplikasi background,0,0,0,0,0,0,0,0,0,0,0,0
"Fitur tombol kamera iPhone 16 kurang berguna bagi pengguna awam,  pengguna biasa lebih sering pakai mode auto dan fitur tombol kamera jadi kurang dimanfaatkan.",0,0,0,0,0,0,0,0,0,0,1,0,0,,"Fitur tombol kamera iPhone 16 kurang berguna bagi pengguna awam,  pengguna biasa lebih sering pakai mode auto dan fitur tombol kamera jadi kurang dimanfaatkan. ",fitur tombol kamera guna guna awam guna pakai mode auto fitur tombol kamera manfaat,0,0,0,0,0,0,0,0,0,1,0,0
"Self timer output kamera iPhone 16 lambat diatur, self timer sulit diatur waktunya dan kurang praktis untuk menghasilkan output foto self-portrait atau foto grup, tidak instan.",0,0,0,0,0,0,0,1,0,0,0,0,0,,"Self timer output kamera iPhone 16 lambat diatur, self timer sulit diatur waktunya dan kurang praktis untuk menghasilkan output foto self-portrait atau foto grup, tidak instan. ",self timer output kamera lambat atur self timer sulit atur praktis hasil output foto selfportrait foto grup instan,0,0,0,0,0,0,1,0,0,0,0,0
"Suara game iPhone 16 ini jelek dan mendem, performanya audio berkualitas rendah bikin pengalaman ngegame jadi datar dan membosankan.",0,0,0,0,0,1,0,0,0,0,0,0,0,,"Suara game iPhone 16 ini jelek dan mendem, performanya audio berkualitas rendah bikin pengalaman ngegame jadi datar dan membosankan. ",suara game jelek mendem performa audio kualitas rendah bikin alam ngegame datar bosan,0,0,0,0,1,0,0,0,0,0,0,0
"Bluetooth iPhone 16 enhanced connection establishment benefitnya kurang signifikan, pairing Bluetooth udah cukup cepat di versi sebelumnya.",0,0,0,0,0,0,0,0,0,1,0,0,0,,"Bluetooth iPhone 16 enhanced connection establishment benefitnya kurang signifikan, pairing Bluetooth udah cukup cepat di versi sebelumnya. ",bluetooth enhanced connection establishment benefitnya signifikan pairing bluetooth cepat versi,0,0,0,0,0,0,0,0,1,0,0,0
"Casing ESR untuk iPhone 16 Pro Kontrol Kamera Kompatibel dengan Casing Ponsel Magnetik Perlindungan Kelas Militer MagSafe Tahan Guncangan. Temukan di Amazon, beli $14. 99  ESR iPhone 16 Pro Case adalah produk menonjol yang https://t.co/4xFS8K1gRZ",0,0,0,0,0,0,0,0,0,0,0,0,2,,"Casing ESR untuk iPhone 16 Pro Kontrol Kamera Kompatibel dengan Casing Ponsel Magnetik Perlindungan Kelas Militer MagSafe Tahan Guncangan. Temukan di Amazon, beli $14. 99  ESR iPhone 16 Pro Case adalah produk menonjol yang https://t.co/4xFS8K1gRZ ",casing esr kontrol kamera kompatibel casing ponsel magnetik lindung kelas militer magsafe tahan guncang temu amazon beli esr case tonjol,0,0,0,0,0,0,2,0,0,0,0,2
Panduan penggunaan aksesoris iPhone 16 lengkap dan mudah dipahami oleh pengguna awam.,0,0,0,0,0,0,0,0,0,0,0,0,2,,Panduan penggunaan aksesoris iPhone 16 lengkap dan mudah dipahami oleh pengguna awam. ,pandu guna aksesoris lengkap mudah paham guna awam,0,0,0,0,0,0,0,0,0,0,0,2
serius properti kia amp apple rilis amp usbc port telepon carplay fitur usbc port telluride data lisensi pengisian cepat kia carplay,0,0,0,0,0,0,0,0,0,1,0,0,0,,serius properti kia amp apple rilis amp usbc port telepon carplay fitur usbc port telluride data lisensi pengisian cepat kia carplay ,serius properti kia amp rilis amp usbc port telepon carplay fitur usbc port telluride data lisensi isi cepat kia carplay,0,0,0,0,0,0,0,0,1,0,0,0
"Desain bodi iPhone 16 ini simple but significant, gak perlu banyak ornamen tapi tetep keliatan berkelas.",0,0,2,0,0,0,0,0,0,0,0,0,0,,"Desain bodi iPhone 16 ini simple but significant, gak perlu banyak ornamen tapi tetep keliatan berkelas. ",desain bodi simple but significant ornamen kelas,0,2,0,0,0,0,0,0,0,0,0,0
"Animasi IOS 18 iPhone 16 gak lebay, pas smooth nya, gak bikin eneg diliat terus-terusan.",0,0,0,0,2,0,0,0,0,0,0,0,0,,"Animasi IOS 18 iPhone 16 gak lebay, pas smooth nya, gak bikin eneg diliat terus-terusan. ",animasi ios lebay pas smooth nya bikin eneg terusterusan,0,0,0,2,0,0,0,0,0,0,0,0
"Bodi iPhone 16 keropos, kayak gampang rusak dan gak tahan lama. Durabilitasnya dipertanyakan.",0,0,1,0,0,0,0,0,0,0,0,0,0,,"Bodi iPhone 16 keropos, kayak gampang rusak dan gak tahan lama. Durabilitasnya dipertanyakan. ",bodi keropos kayak gampang rusak tahan durabilitasnya,0,1,0,0,0,0,0,0,0,0,0,0
"iPhone 16 ini gesit banget di jari dalam hal memory management, semua gesture memory dan touch memory direspon dengan cepat dan akurat saat manajemen file dan data*.""",0,0,0,0,0,0,2,0,0,0,0,0,0,,"iPhone 16 ini gesit banget di jari dalam hal memory management, semua gesture memory dan touch memory direspon dengan cepat dan akurat saat manajemen file dan data*."" ",gesit banget jari memory management gesture memory touch memory direspon cepat akurat manajemen file data,0,0,0,0,0,2,0,0,0,0,0,0
"Contrast output iPhone 16 cepat diatur, contrast mudah diatur levelnya untuk mengatur perbedaan terang dan gelap pada output foto dan video, instan.",0,0,0,0,0,0,0,2,0,0,0,0,0,,"Contrast output iPhone 16 cepat diatur, contrast mudah diatur levelnya untuk mengatur perbedaan terang dan gelap pada output foto dan video, instan. ",contrast output cepat atur contrast mudah atur level atur beda terang gelap output foto video instan,0,0,0,0,0,0,2,0,0,0,0,0
"Bluetooth iPhone 16 direction finding in Bluetooth Mesh fitur terlalu enterprise-focused dan specific, pengguna awam gak kepakai fitur Bluetooth Mesh.",0,0,0,0,0,0,0,0,0,1,0,0,0,,"Bluetooth iPhone 16 direction finding in Bluetooth Mesh fitur terlalu enterprise-focused dan specific, pengguna awam gak kepakai fitur Bluetooth Mesh. ",bluetooth direction finding bluetooth mesh fitur enterprisefocused specific guna awam pakai fitur bluetooth mesh,0,0,0,0,0,0,0,0,1,0,0,0
"Penggantian baterai iPhone 16  di service center resmi Apple mahal banget,  biaya ganti baterai hampir setengah harga HP baru,  mendingan ganti HP baru sekalian.",0,0,0,0,0,0,0,0,0,0,0,1,0,,"Penggantian baterai iPhone 16  di service center resmi Apple mahal banget,  biaya ganti baterai hampir setengah harga HP baru,  mendingan ganti HP baru sekalian. ",ganti baterai service center resmi mahal banget biaya ganti baterai harga hp mending ganti hp,0,0,0,0,0,0,0,0,0,0,1,0
"IOS 18 di iPhone 16 UI-nya gak neko-neko, langsung ke inti fungsi, simpel tapi ngena.",0,0,0,0,2,0,0,0,0,0,0,0,0,,"IOS 18 di iPhone 16 UI-nya gak neko-neko, langsung ke inti fungsi, simpel tapi ngena. ",ios uinya nekoneko langsung inti fungsi simpel ngena,0,0,0,2,0,0,0,0,0,0,0,0
"Kecepatan loading game iPhone 16 ini cepat, gak pake nunggu lama buat masuk game.""",0,0,0,0,0,2,0,0,0,0,0,0,0,,"Kecepatan loading game iPhone 16 ini cepat, gak pake nunggu lama buat masuk game."" ",cepat loading game cepat pakai nunggu masuk game,0,0,0,0,2,0,0,0,0,0,0,0
"Action Button iPhone 16  gak bisa custom buat ganti mode kamera tertentu,  harus tetap ganti mode manual di aplikasi kamera.",0,0,0,0,0,0,0,0,0,0,1,0,0,,"Action Button iPhone 16  gak bisa custom buat ganti mode kamera tertentu,  harus tetap ganti mode manual di aplikasi kamera. ",action button custom ganti mode kamera ganti mode manual aplikasi kamera,0,0,0,0,0,0,2,0,0,1,0,0
